[
   {
   	"name": "AD_SERVER_001",
	"description": "AD Server",
   	"interval": 2,
	"secretvaultname": "SecretStore",
   	"credentialname": "devadmin",
   	"servers": [
   		{
   			"computername": "DEV-DC",
   			"comment": "Domain Controller",
   			"counterConfig": [
   				"CPU"
   			]
   		}
   	]
   }
]